{
  "legend": {
    "#": "wall",
    "W": "window",
    "G": "glass",
    "D": "door_open",
    "d": "door_closed",
    ".": "floor",
    "h": "floor_hallway",
    "_": "void"
  },
  "rows": [
    "##########____",
    "dhhhhhhhh#____",
    "#hhhhhhhh#____",
    "#GGGGDGGG#####",
    "W............#",
    "W............#",
    "W............#",
    "W............#",
    "W............#",
    "W............#",
    "W............#",
    "##############"
  ],
  "playerStart": { "col": 8, "row": 7, "facing": "N" },
  "furniture": [
    { "id": "table-1", "asset": "table_long", "col": 2, "row": 5, "facing": "S" },
    { "id": "chair-north-1", "asset": "chair", "col": 2, "row": 4, "facing": "S" },
    { "id": "chair-north-2", "asset": "chair", "col": 3, "row": 4, "facing": "S" },
    { "id": "chair-north-3", "asset": "chair", "col": 4, "row": 4, "facing": "S" },
    { "id": "chair-south-1", "asset": "chair", "col": 2, "row": 7, "facing": "N" },
    { "id": "chair-south-2", "asset": "chair", "col": 3, "row": 7, "facing": "N" },
    { "id": "chair-south-3", "asset": "chair", "col": 4, "row": 7, "facing": "N" },
    { "id": "chair-west", "asset": "chair", "col": 1, "row": 5, "facing": "E" },
    { "id": "chair-east", "asset": "chair", "col": 5, "row": 6, "facing": "W" },
    { "id": "coffee-table-1", "asset": "coffee_table", "col": 6, "row": 8, "facing": "S" },
    { "id": "sofa-1", "asset": "sofa", "col": 6, "row": 9, "facing": "N" },
    { "id": "counter-1", "asset": "counter_drawers", "col": 9, "row": 4, "facing": "S" },
    { "id": "counter-2", "asset": "counter_sink", "col": 10, "row": 4, "facing": "S" },
    { "id": "counter-3", "asset": "counter_cabinet", "col": 11, "row": 4, "facing": "S" },
    { "id": "fridge-1", "asset": "fridge", "col": 12, "row": 4, "facing": "S" },
    { "id": "drawers-1", "asset": "drawer_cabinet", "col": 12, "row": 7, "facing": "W" },
    { "id": "plant-nw", "asset": "plant_3", "col": 1, "row": 4, "facing": "S" },
    { "id": "plant-door", "asset": "plant_1", "col": 6, "row": 4, "facing": "S" },
    { "id": "plant-sw", "asset": "plant_2", "col": 1, "row": 10, "facing": "S" },
    { "id": "plant-se", "asset": "plant_1", "col": 12, "row": 10, "facing": "S" }
  ],
  "props": [
    { "asset": "papers", "x": 2.8, "y": 0.755, "z": 5.8, "rotationDeg": 15 },
    { "asset": "papers", "x": 4.2, "y": 0.755, "z": 6.25, "rotationDeg": -12 },
    { "asset": "coffee_cup", "x": 3.55, "y": 0.755, "z": 6.42, "rotationDeg": 0 },
    { "asset": "mug", "x": 4.4, "y": 0.755, "z": 5.62, "rotationDeg": 200 },
    { "asset": "coffee_cup", "x": 4.58, "y": 0.755, "z": 6.45, "rotationDeg": -60 },
    { "asset": "coffee_cup", "x": 2.45, "y": 0.755, "z": 6.3, "rotationDeg": 30 },
    { "asset": "food_muffin", "x": 3.9, "y": 0.755, "z": 5.75, "rotationDeg": 0 },
    { "asset": "mug", "x": 6.7, "y": 0.392, "z": 8.45, "rotationDeg": 140 },
    { "asset": "papers", "x": 7.3, "y": 0.392, "z": 8.55, "rotationDeg": 30 },
    { "asset": "coffee_machine", "x": 9.28, "y": 0.81, "z": 3.86, "rotationDeg": 0 },
    { "asset": "mug", "x": 9.58, "y": 0.81, "z": 4.02, "rotationDeg": 90 },
    { "asset": "food_apple", "x": 9.62, "y": 0.81, "z": 3.78, "rotationDeg": 0 },
    { "asset": "food_croissant", "x": 9.86, "y": 0.81, "z": 3.95, "rotationDeg": 60 },
    { "asset": "microwave", "x": 11.35, "y": 0.785, "z": 3.86, "rotationDeg": 0 },
    { "asset": "toaster", "x": 11.8, "y": 0.785, "z": 3.9, "rotationDeg": 90 }
  ]
}
